{
  "schema_version": "boq-core.support-manifest.v1",
  "crate_version": "0.1.0",
  "support_vocabulary": [
    "supported",
    "supported_parse_only",
    "future_track",
    "reference_only"
  ],
  "entries": [
    {
      "fixture_id": "avacloud_demo_node",
      "source_family": "developer_examples",
      "process_domain": "generated_gaeb_examples",
      "gaeb_version": "mixed",
      "phase": "mixed",
      "target_dir": "gaeb/developer_examples/avacloud_demo_node",
      "support_status": "future_track",
      "capabilities": {
        "detect": true,
        "parse": false,
        "validate": false,
        "adapt_to_obra": false,
        "export": false,
        "roundtrip": false,
        "certification": false,
        "reference_only": true
      },
      "source_policy": {
        "ci_policy": "download_on_demand",
        "license_note": "AVACloud Node.js generated GAEB examples; verify repository license before vendoring.",
        "has_archive_sha256": false,
        "service_export_requires_external_download": false
      },
      "test_mapping": [
        "future_avacloud_demo_node_cataloged"
      ]
    },
    {
      "fixture_id": "bvbs_gaeb_xml_checker",
      "source_family": "bvbs",
      "process_domain": "tooling_reference",
      "gaeb_version": "gaeb_xml_checker",
      "phase": "tool",
      "target_dir": "gaeb/tools/bvbs_gaeb_xml_checker",
      "support_status": "reference_only",
      "capabilities": {
        "detect": true,
        "parse": false,
        "validate": false,
        "adapt_to_obra": false,
        "export": false,
        "roundtrip": false,
        "certification": false,
        "reference_only": true
      },
      "source_policy": {
        "ci_policy": "download_on_demand",
        "license_note": "External checker tool; catalog checksum/version and decide invocation policy before use.",
        "has_archive_sha256": false,
        "service_export_requires_external_download": false
      },
      "test_mapping": []
    },
    {
      "fixture_id": "bvbs_xml31_bau_criteria_pdf",
      "source_family": "bvbs",
      "process_domain": "legacy_xml_3_1",
      "gaeb_version": "gaeb_xml_3_1",
      "phase": "criteria_pdf",
      "target_dir": "gaeb/bvbs/gaeb_xml_3_1/legacy_xml_3_1/construction_execution/criteria_pdf",
      "support_status": "reference_only",
      "capabilities": {
        "detect": true,
        "parse": false,
        "validate": false,
        "adapt_to_obra": false,
        "export": false,
        "roundtrip": false,
        "certification": false,
        "reference_only": true
      },
      "source_policy": {
        "ci_policy": "download_on_demand",
        "license_note": "Legacy GAEB XML 3.1 Bauausfuehrung criteria PDF; compatibility evidence only.",
        "has_archive_sha256": false,
        "service_export_requires_external_download": false
      },
      "test_mapping": []
    },
    {
      "fixture_id": "bvbs_xml31_bau_criteria_supplement",
      "source_family": "bvbs",
      "process_domain": "legacy_xml_3_1",
      "gaeb_version": "gaeb_xml_3_1",
      "phase": "criteria_supplement",
      "target_dir": "gaeb/bvbs/gaeb_xml_3_1/legacy_xml_3_1/construction_execution/criteria_supplement",
      "support_status": "reference_only",
      "capabilities": {
        "detect": true,
        "parse": false,
        "validate": false,
        "adapt_to_obra": false,
        "export": false,
        "roundtrip": false,
        "certification": false,
        "reference_only": true
      },
      "source_policy": {
        "ci_policy": "download_on_demand",
        "license_note": "Legacy GAEB XML 3.1 Bauausfuehrung supplemental criteria list; compatibility evidence only.",
        "has_archive_sha256": false,
        "service_export_requires_external_download": false
      },
      "test_mapping": []
    },
    {
      "fixture_id": "bvbs_xml31_bau_pdf",
      "source_family": "bvbs",
      "process_domain": "legacy_xml_3_1",
      "gaeb_version": "gaeb_xml_3_1",
      "phase": "pdf_reference",
      "target_dir": "gaeb/bvbs/gaeb_xml_3_1/legacy_xml_3_1/construction_execution/pdf_reference",
      "support_status": "reference_only",
      "capabilities": {
        "detect": true,
        "parse": false,
        "validate": false,
        "adapt_to_obra": false,
        "export": false,
        "roundtrip": false,
        "certification": false,
        "reference_only": true
      },
      "source_policy": {
        "ci_policy": "download_on_demand",
        "license_note": "Legacy GAEB XML 3.1 Bauausfuehrung visual PDF; manual/reference evidence only.",
        "has_archive_sha256": false,
        "service_export_requires_external_download": false
      },
      "test_mapping": []
    },
    {
      "fixture_id": "bvbs_xml31_bau_x83",
      "source_family": "bvbs",
      "process_domain": "legacy_xml_3_1",
      "gaeb_version": "gaeb_xml_3_1",
      "phase": "x83",
      "target_dir": "gaeb/bvbs/gaeb_xml_3_1/legacy_xml_3_1/construction_execution/x83",
      "support_status": "future_track",
      "capabilities": {
        "detect": true,
        "parse": false,
        "validate": false,
        "adapt_to_obra": false,
        "export": false,
        "roundtrip": false,
        "certification": false,
        "reference_only": true
      },
      "source_policy": {
        "ci_policy": "download_on_demand",
        "license_note": "Legacy GAEB XML 3.1 BVBS Bauausfuehrung X83 fixture; future compatibility track.",
        "has_archive_sha256": false,
        "service_export_requires_external_download": false
      },
      "test_mapping": [
        "test_xml31_bau_sources_are_cataloged_before_parser_promotion"
      ]
    },
    {
      "fixture_id": "bvbs_xml31_bau_x84",
      "source_family": "bvbs",
      "process_domain": "legacy_xml_3_1",
      "gaeb_version": "gaeb_xml_3_1",
      "phase": "x84",
      "target_dir": "gaeb/bvbs/gaeb_xml_3_1/legacy_xml_3_1/construction_execution/x84",
      "support_status": "future_track",
      "capabilities": {
        "detect": true,
        "parse": false,
        "validate": false,
        "adapt_to_obra": false,
        "export": false,
        "roundtrip": false,
        "certification": false,
        "reference_only": true
      },
      "source_policy": {
        "ci_policy": "download_on_demand",
        "license_note": "Legacy GAEB XML 3.1 BVBS Bauausfuehrung X84 fixture; future compatibility track.",
        "has_archive_sha256": false,
        "service_export_requires_external_download": false
      },
      "test_mapping": [
        "test_xml31_bau_sources_are_cataloged_before_parser_promotion"
      ]
    },
    {
      "fixture_id": "bvbs_xml32_ava_x81",
      "source_family": "bvbs",
      "process_domain": "legacy_xml_3_2",
      "gaeb_version": "gaeb_xml_3_2",
      "phase": "x81",
      "target_dir": "gaeb/bvbs/gaeb_xml_3_2/legacy_xml_3_2/ava/x81",
      "support_status": "future_track",
      "capabilities": {
        "detect": true,
        "parse": false,
        "validate": false,
        "adapt_to_obra": false,
        "export": false,
        "roundtrip": false,
        "certification": false,
        "reference_only": true
      },
      "source_policy": {
        "ci_policy": "download_on_demand",
        "license_note": "Legacy GAEB XML 3.2 BVBS AVA fixture; future compatibility track.",
        "has_archive_sha256": false,
        "service_export_requires_external_download": false
      },
      "test_mapping": [
        "future_legacy_xml32_ava_x81_cataloged"
      ]
    },
    {
      "fixture_id": "bvbs_xml32_ava_x84",
      "source_family": "bvbs",
      "process_domain": "legacy_xml_3_2",
      "gaeb_version": "gaeb_xml_3_2",
      "phase": "x84",
      "target_dir": "gaeb/bvbs/gaeb_xml_3_2/legacy_xml_3_2/ava/x84",
      "support_status": "future_track",
      "capabilities": {
        "detect": true,
        "parse": false,
        "validate": false,
        "adapt_to_obra": false,
        "export": false,
        "roundtrip": false,
        "certification": false,
        "reference_only": true
      },
      "source_policy": {
        "ci_policy": "download_on_demand",
        "license_note": "Legacy GAEB XML 3.2 BVBS AVA fixture; future compatibility track.",
        "has_archive_sha256": false,
        "service_export_requires_external_download": false
      },
      "test_mapping": [
        "future_legacy_xml32_ava_x84_cataloged"
      ]
    },
    {
      "fixture_id": "bvbs_xml32_ava_x86",
      "source_family": "bvbs",
      "process_domain": "legacy_xml_3_2",
      "gaeb_version": "gaeb_xml_3_2",
      "phase": "x86",
      "target_dir": "gaeb/bvbs/gaeb_xml_3_2/legacy_xml_3_2/ava/x86",
      "support_status": "future_track",
      "capabilities": {
        "detect": true,
        "parse": false,
        "validate": false,
        "adapt_to_obra": false,
        "export": false,
        "roundtrip": false,
        "certification": false,
        "reference_only": true
      },
      "source_policy": {
        "ci_policy": "download_on_demand",
        "license_note": "Legacy GAEB XML 3.2 BVBS AVA fixture; future compatibility track.",
        "has_archive_sha256": false,
        "service_export_requires_external_download": false
      },
      "test_mapping": [
        "future_legacy_xml32_ava_x86_cataloged"
      ]
    },
    {
      "fixture_id": "bvbs_xml32_bau_criteria_pdf",
      "source_family": "bvbs",
      "process_domain": "legacy_xml_3_2",
      "gaeb_version": "gaeb_xml_3_2",
      "phase": "criteria_pdf",
      "target_dir": "gaeb/bvbs/gaeb_xml_3_2/legacy_xml_3_2/construction_execution/criteria_pdf",
      "support_status": "reference_only",
      "capabilities": {
        "detect": true,
        "parse": false,
        "validate": false,
        "adapt_to_obra": false,
        "export": false,
        "roundtrip": false,
        "certification": false,
        "reference_only": true
      },
      "source_policy": {